[
  {
    "user_id": "user_1",
    "total_articles": 2,
    "category_preferences": {
      "politics": 50.0,
      "technology": 0.0,
      "crime_justice": 0.0,
      "business_economy": 0.0,
      "international": 0.0,
      "entertainment": 0.0,
      "health": 0.0,
      "sports": 0.0,
      "environment": 0.0
    },
    "dominant_categories": [
      "politics"
    ],
    "sentiment_analysis": {
      "positive": 0,
      "negative": 0,
      "neutral": 1
    },
    "content_depth_preference": "mixed",
    "geographic_interest": [
      "france",
      "uk"
    ],
    "time_sensitivity": "mixed",
    "detailed_summary": "Okay, I've analyzed the news consumption patterns for user_1. Here's a breakdown of the key observations:\n\n*   **Category Preference:** The user shows a strong preference for **politics**, which accounts for 50% of their article consumption. Other categories are currently unrepresented.\n*   **Sentiment:** The sentiment analysis indicates a **neutral** leaning. This suggests the user is consuming news in a relatively objective manner or that the articles themselves present information without strong emotional bias.\n*   **Reading Depth:** A \"mixed\" depth suggests that the user engages with both surface-level and in-depth articles.\n*   **Time Focus:** A \"mixed\" time focus likely means the user reads both current events and articles with a longer time horizon (e.g., analyses, historical pieces).\n*   **Geographic Focus:** The user has shown interest in news related to **France** and the **UK**.\n*   **Title Analysis:** The sample titles confirm the interest in politics, with coverage of international political events (France/Lebanon) and UK-US relations.\n\n**In summary:** User_1 is primarily interested in political news with a focus on France, the UK, and international relations. Their consumption appears to be neutral in sentiment and includes articles of varying depth and time relevance. It would be beneficial to understand the user's evolving interests by tracking their consumption patterns over a longer period and a wider variety of articles."
  },
  {
    "user_id": "user_2",
    "total_articles": 4,
    "category_preferences": {
      "politics": 25.0,
      "technology": 0.0,
      "crime_justice": 50.0,
      "business_economy": 0.0,
      "international": 0.0,
      "entertainment": 0.0,
      "health": 25.0,
      "sports": 25.0,
      "environment": 0.0
    },
    "dominant_categories": [
      "crime_justice",
      "politics",
      "health"
    ],
    "sentiment_analysis": {
      "positive": 0,
      "negative": 2,
      "neutral": 0
    },
    "content_depth_preference": "breaking_news",
    "geographic_interest": [
      "japan",
      "asia",
      "canada"
    ],
    "time_sensitivity": "real_time",
    "detailed_summary": "Okay, I've analyzed the provided news consumption data for user_2. Here's a breakdown of their reading preferences:\n\n*   **Category Preferences:** The user shows a strong interest in \"crime\\_justice\" (50%) and \"politics\" (25%). They also have some interest in \"health\" and \"sports\" (25%). They do not seem interested in \"technology\", \"business\\_economy\", \"international\", \"entertainment\", and \"environment\".\n*   **Sentiment:** The user has only read negative articles.\n*   **Depth:** The user prefers breaking news.\n*   **Time:** The user prefers real time news.\n*   **Geographic Focus:** The user is interested in news related to Japan, Asia, and Canada.\n*   **Sample Titles Insights:** The titles confirm the interest in crime and justice, politics, and geography.\n\n**Summary:** User\\_2 is primarily interested in crime and justice related news, with a secondary interest in political, health and sports news. They prefer breaking news, and are interested in news from Japan, Asia, and Canada. They seem to lean towards negative news."
  },
  {
    "user_id": "user_3",
    "total_articles": 5,
    "category_preferences": {
      "politics": 40.0,
      "technology": 0.0,
      "crime_justice": 40.0,
      "business_economy": 0.0,
      "international": 20.0,
      "entertainment": 0.0,
      "health": 20.0,
      "sports": 20.0,
      "environment": 0.0
    },
    "dominant_categories": [
      "politics",
      "crime_justice",
      "international"
    ],
    "sentiment_analysis": {
      "positive": 0,
      "negative": 1,
      "neutral": 1
    },
    "content_depth_preference": "mixed",
    "geographic_interest": [
      "canada",
      "australia",
      "uk",
      "asia",
      "japan"
    ],
    "time_sensitivity": "mixed",
    "detailed_summary": "Okay, I've analyzed the provided news consumption data for user_3. Here's a breakdown of their reading habits:\n\n**Category Preferences:**\n\n*   **Strong Interest in Politics and Crime/Justice:** These categories dominate the user's reading, accounting for 40% each. This suggests a keen interest in current affairs, legal matters, and potentially social issues.\n*   **Some Interest in International News, Health and Sports:** The user shows some interest in international events, health-related topics and sports (20% each).\n*   **No Apparent Interest in Technology, Business/Economy, or Environment:** These categories are absent from the user's reading history, indicating a lack of interest or perhaps a deliberate avoidance of these topics.\n\n**Sentiment:**\n\n*   **Predominantly Negative Sentiment:** The sentiment analysis indicates a tendency towards negative news, with a negative sentiment count of 1, compared to 1 neutral. It's difficult to make a conclusion with such limited information.\n\n**Depth & Time:**\n\n*   **Mixed Depth and Time:** The user engages with both in-depth articles and quick reads, and their reading times vary. This suggests a flexible approach to news consumption, adapting to the available time and the nature of the content.\n\n**Geographic Focus:**\n\n*   **Wide Geographic Scope:** The user consumes news from Canada, Australia, the UK, Asia and Japan. This indicates a broad interest in global events and developments, rather than being confined to a single region.\n\n**Insights & Potential Interests:**\n\n*   The user is likely interested in global political events, especially those with a crime or justice angle.\n*   The user may be interested in international relations, government policies, and legal proceedings in various countries.\n*   Given the interest in both crime/justice and international news, the user might be drawn to stories about international crime, human rights issues, or political corruption.\n*   The user's lack of interest in business/economy and technology might indicate a focus on social and political issues over economic or technological advancements.\n\n**Recommendations (based on observed preferences):**\n\nTo further refine the user's news feed, consider these strategies:\n\n*   **Prioritize political and crime/justice news:** Ensure these categories are prominently featured.\n*   **Offer international perspectives:** Provide news from a variety of global sources, focusing on the regions already showing interest (Canada, Australia, UK, Asia, Japan).\n*   **Introduce related topics:** Given the interest in crime/justice, consider suggesting articles on human rights, social justice, or legal reform.\n*   **Monitor sentiment:** Pay attention to the sentiment of articles to avoid overwhelming the user with negativity, while still catering to their interest in these topics."
  },
  {
    "user_id": "user_4",
    "total_articles": 6,
    "category_preferences": {
      "politics": 50.0,
      "technology": 50.0,
      "crime_justice": 16.67,
      "business_economy": 0.0,
      "international": 33.33,
      "entertainment": 16.67,
      "health": 0.0,
      "sports": 0.0,
      "environment": 0.0
    },
    "dominant_categories": [
      "politics",
      "technology",
      "international"
    ],
    "sentiment_analysis": {
      "positive": 0,
      "negative": 2,
      "neutral": 0
    },
    "content_depth_preference": "mixed",
    "geographic_interest": [
      "canada",
      "australia",
      "china",
      "usa",
      "asia"
    ],
    "time_sensitivity": "mixed",
    "detailed_summary": "Okay, I've analyzed the news consumption patterns of user_4. Here's a breakdown of their reading preferences:\n\n*   **Category Focus:** This user shows a strong interest in both politics and technology, with equal consumption in these areas. International news also ranks high. They have some interest in crime/justice and entertainment but completely avoid topics like business/economy, health, sports, and environment.\n*   **Sentiment:** The user has primarily consumed negative news.\n*   **Depth:** The \"mixed\" depth suggests the user reads both in-depth articles and shorter news pieces.\n*   **Time:** \"Mixed\" time suggests the user consumes both recent and older articles.\n*   **Geographic Focus:** The user is interested in news from a variety of regions, including Canada, Australia, China, the USA, and Asia more broadly.\n*   **Title Analysis:** The sample titles reinforce the category analysis (politics, international news) and the negative sentiment (reports of conflict, crime, and accidental death). The Coldplay and South Park titles show interest in entertainment.\n\nIn summary, user_4 is interested in staying informed about political and technological developments around the world, with a particular focus on negative events. They also have a casual interest in entertainment news."
  },
  {
    "user_id": "user_5",
    "total_articles": 3,
    "category_preferences": {
      "politics": 33.33,
      "technology": 33.33,
      "crime_justice": 33.33,
      "business_economy": 0.0,
      "international": 33.33,
      "entertainment": 66.67,
      "health": 0.0,
      "sports": 0.0,
      "environment": 0.0
    },
    "dominant_categories": [
      "entertainment",
      "politics",
      "technology"
    ],
    "sentiment_analysis": {
      "positive": 0,
      "negative": 0,
      "neutral": 0
    },
    "content_depth_preference": "mixed",
    "geographic_interest": [
      "australia",
      "canada"
    ],
    "time_sensitivity": "mixed",
    "detailed_summary": "Okay, I've analyzed the news consumption patterns for user_5. Here's a breakdown of the key observations:\n\n*   **Category Preferences:** The user shows a strong interest in 'entertainment' (66.67%), followed by a balanced interest in 'politics', 'technology', 'crime\\_justice', and 'international' (all at 33.33%). They do not seem interested in 'business\\_economy', 'health', 'sports', or 'environment'.\n*   **Sentiment:** The sentiment analysis is currently neutral across the articles read. This suggests the user isn't exclusively drawn to positive or negative news, but this could change with a larger sample size.\n*   **Depth and Time:** The \"mixed\" depth and time indicate a varied consumption pattern. The user is not consistently reading in-depth articles or articles from a particular time frame.\n*   **Geographic Focus:** The user has shown interest in news related to 'Australia' and 'Canada'.\n*   **Title Analysis:** The sample titles reinforce the user's interest in entertainment (Coldplay concert, Reneé Rapp) and politics/crime (Australian politician found guilty of rape).\n\n**Insights and Potential Interests:**\n\n*   The user has a diverse set of interests, spanning entertainment, politics, technology, crime, and international news.\n*   The high engagement with entertainment news suggests a possible preference for lighter, more engaging content. The specific examples (Coldplay, Reneé Rapp) indicate an interest in celebrity news and pop culture.\n*   The user is interested in news from both Australia and Canada.\n\nTo further refine this analysis, it would be helpful to have:\n\n*   A larger sample size of articles to confirm these trends and identify any emerging interests.\n*   More specific information about the \"depth\" and \"time\" characteristics of the articles (e.g., average article length, publication dates).\n*   Sentiment analysis of a larger sample size.\n\nBased on the current data, I would recommend providing user\\_5 with a mix of entertainment news, particularly focusing on celebrity culture, and political/international news with a focus on Australia and Canada. Articles related to technology and crime from these regions might also be of interest."
  }
]