[
  {
    "user_id": "user_1",
    "total_articles": 5,
    "dominant_categories": [
      "general"
    ],
    "sentiment_analysis": {
      "positive": 0,
      "negative": 1,
      "neutral": 0
    },
    "content_depth_preference": "analysis",
    "geographic_interest": [
      "Afghanistan",
      "Australia",
      "Baisaran",
      "Canberra",
      "Dachigam"
    ],
    "time_sensitivity": "recent",
    "ner_analysis": {
      "Person": [
        "Abdullah Shafique",
        "B R Gavai",
        "Babar Azam",
        "Basit Ali",
        "Bhushan R Gavai"
      ],
      "Location": [
        "Afghanistan",
        "Australia",
        "Baisaran",
        "Canberra",
        "Dachigam"
      ],
      "Organization": [
        "ABC",
        "Australian Broadcasting Corporation",
        "BCCI",
        "Centre",
        "China"
      ]
    },
    "detailed_summary": "Based on the provided data, here's an analysis of user_1's news consumption:\n\n*   **Focus:** The user shows interest in news related to India and Australia, evident from the locations and organizations mentioned (e.g., 'J&K statehood plea', 'BCCI', 'Australia'). There's also a possible inclination towards legal or governmental topics, indicated by \"SC cites Pahalgam attack\" and the presence of legal figures like 'B R Gavai' and 'Bhushan R Gavai'. Interest in cricket can be inferred from names like 'Abdullah Shafique', 'Babar Azam', and 'Basit Ali'.\n*   **Sentiment:** The user has consumed articles with a negative sentiment.\n*   **Depth:** The 'analysis' depth suggests the user is engaging with more in-depth reporting or opinion pieces, rather than just headlines."
  },
  {
    "user_id": "user_2",
    "total_articles": 4,
    "dominant_categories": [
      "politics",
      "technology",
      "business_economy"
    ],
    "sentiment_analysis": {
      "positive": 0,
      "negative": 0,
      "neutral": 0
    },
    "content_depth_preference": "analysis",
    "geographic_interest": [
      "Alaska",
      "Black Sea",
      "Crimean peninsula",
      "Delhi",
      "Delhi-NCR"
    ],
    "time_sensitivity": "recent",
    "ner_analysis": {
      "Person": [
        "Abhishek Manu Singhvi",
        "Donald Trump",
        "JB Pardiwala",
        "Kapil Sibal",
        "NV Anjaria"
      ],
      "Location": [
        "Alaska",
        "Black Sea",
        "Crimean peninsula",
        "Delhi",
        "Delhi-NCR"
      ],
      "Organization": [
        "Animal Birth Control (ABC)",
        "Dow",
        "Dow Jones Industrial Average",
        "Federal Reserve",
        "Foxconn"
      ]
    },
    "detailed_summary": "Okay, here's an analysis of user_2's news consumption patterns:\n\n**Overall Interests:** The user shows interest in a mix of politics, technology, and business/economy.\n\n**Political Focus:** A significant portion of their consumption relates to politics, with a focus on legal figures ('Abhishek Manu Singhvi', 'Kapil Sibal', 'JB Pardiwala', 'NV Anjaria') and specific locations ('Delhi', 'Delhi-NCR'). The mention of \"stray dogs case, top court raps civic bodies\" suggests an interest in local governance or legal proceedings.\n\n**Business and Technology:** The user is tracking business and technology news, specifically the performance and forecasts of 'Foxconn' and the 'Dow Jones Industrial Average'. They are also following economic indicators with interest in US inflation data and potential 'Federal Reserve' rate cuts. The reference to AI demand suggests an interest in emerging technologies.\n\n**Geographic Focus:** Beyond the Indian focus in the political articles, there's also an interest in international affairs, specifically related to 'Ukraine' ('Black Sea', 'Crimean peninsula'). The inclusion of 'Alaska' is less clear but could relate to energy, climate, or geopolitical topics.\n\n**Sentiment:** The neutral sentiment score suggests an objective consumption of news rather than being drawn to overly positive or negative framing.\n\n**In summary:** user_2 appears to be a well-rounded news consumer with specific interests in Indian politics and law, technology companies like Foxconn, US economic trends, and the Ukraine conflict."
  }
]